Title,Year,Rated,Released,Runtime,Genre,Director,Writer,Actors,Plot,Language,Country,Awards,Poster,Ratings,Metascore,imdbRating,imdbVotes,imdbID,Type,DVD,BoxOffice,Production,Website,Response
Yuva,2004,Not Rated,21 May 2004,161 min,"Action, Drama, Thriller",Mani Ratnam,"Anurag Kashyap, Mani Ratnam","Ajay Devgn, Abhishek Bachchan, Rani Mukerji","Michael (Ajay Devgan) , Arjun (Vivek Oberoi) and Lallan (Abhishek Bachchan) are three young men in Kolkata , with different ideals and objectives . Michael is an idealistic youth leader who dreams of a better India being created by the youth power . Arjun is a self-centered , opportunistic , easygoing fellow whose objective is to immigrate to a developed country and make big money . Lallan is a goon who works for Prosenjit Chatterjee (Om Puri) , an immoral politician . The lives of these three different people become intertwined following a murder attempt and an accident in broad daylight on the Hooghly bridge .","Hindi, Bengali",India,17 wins & 20 nominations,https://m.media-amazon.com/images/M/MV5BYThmMzU2OGMtYjY4OC00ZmQ2LTk5OWQtYzUyMjFmZTNiOWQwXkEyXkFqcGdeQXVyOTA0NTIzNzU@._V1_SX300.jpg,"[{'Source': 'Internet Movie Database', 'Value': '7.3/10'}, {'Source': 'Metacritic', 'Value': '63/100'}]",63,7.3,"9,321",tt0382383,movie,13 Mar 2017,"$331,166",N/A,N/A,True
Sangharsh,1999,Not Rated,03 Sep 1999,127 min,"Action, Crime, Drama",Tanuja Chandra,"Mahesh Bhatt, Girish Dhamija, Thomas Harris","Preity G Zinta, Akshay Kumar, Ashutosh Rana",CBI officer Reet Oberoi sought assistance from a jail convict Professor Aman Varma to bring Lajja Shankar Pandey; a religious fanatic to justice. Pandey is responsible for abducting children and sacrifice them. But Aman is not willing to co-operate with Reet and instead scuffs at her which leads her into serious problems not only by the police but with some public personalities and the parents of the children affected by Pandey's behavior.,Hindi,India,3 wins & 2 nominations,https://m.media-amazon.com/images/M/MV5BNmU5ZWUxY2QtNWQ0MC00ZDRmLWI2ZGItMDRjODc5ZjYwZmY4L2ltYWdlL2ltYWdlXkEyXkFqcGdeQXVyNjQ2MjQ5NzM@._V1_SX300.jpg,"[{'Source': 'Internet Movie Database', 'Value': '6.7/10'}]",N/A,6.7,"5,743",tt0111068,movie,N/A,N/A,N/A,N/A,True
Wanted,2009,Not Rated,25 Sep 2009,147 min,"Action, Crime, Thriller",Prabhu Deva,"Sunil Kumar Agrawal, Shabbir Ahmed, Shiraz Ahmed","Salman Khan, Ayesha Takia, Prakash Raj","Radhe is a ruthless gangster who will kill anyone for money. He is attracted towards Jhanvi, a middle class girl, who does not approve of his work and wants him to change.",Hindi,India,4 wins & 9 nominations,https://m.media-amazon.com/images/M/MV5BYjI4ZTNmZTYtNTFhZC00Y2RkLTgyM2YtYmZkODZjNWNhMTQyXkEyXkFqcGdeQXVyODE5NzE3OTE@._V1_SX300.jpg,"[{'Source': 'Internet Movie Database', 'Value': '6.6/10'}]",N/A,6.6,"25,845",tt1084972,movie,30 Nov 2016,"$349,637",N/A,N/A,True
Motichoor Chaknachoor,2019,N/A,15 Nov 2019,150 min,"Comedy, Romance",Debamitra Biswal,"Meghvrat Singh Gurjar, Meghvrat Singh","Nawazuddin Siddiqui, Athiya Shetty, Vibha Chhibber","A hilarious story of a 36-year-old jobless man Pushpender, trying to find a wife and Anita who's also looking for a husband. But there's a catch - Anita wants to settle abroad after marriage.",Hindi,India,N/A,https://m.media-amazon.com/images/M/MV5BYjQ3ZjdkOGYtMGJjMy00ODI5LTkwMjAtZTQyZDg4MTYzMTRlXkEyXkFqcGdeQXVyODE5NzE3OTE@._V1_SX300.jpg,"[{'Source': 'Internet Movie Database', 'Value': '5.8/10'}]",N/A,5.8,"3,198",tt9172840,movie,19 Mar 2021,N/A,N/A,N/A,True
Paan Singh Tomar,2012,Not Rated,02 Mar 2012,135 min,"Action, Biography, Crime",Tigmanshu Dhulia,"Sanjay Chauhan, Tigmanshu Dhulia","Irrfan Khan, Mahie Gill, Rajesh Abhay","Paan Singh Tomar is a Hindi-language film, based on the true story of a runner employed by the Army and has won Gold medal at Indian National Games but forced to become notorious baaghi. It is directed by Tigmanshu Dhulia.",Hindi,India,12 wins & 17 nominations,https://m.media-amazon.com/images/M/MV5BNTgwODM5OTMzN15BMl5BanBnXkFtZTcwMTA3NzI1Nw@@._V1_SX300.jpg,"[{'Source': 'Internet Movie Database', 'Value': '8.2/10'}]",N/A,8.2,"37,733",tt1620933,movie,25 Feb 2017,"$40,311",N/A,N/A,True
Sharmaji Namkeen,2022,N/A,31 Mar 2022,119 min,"Comedy, Drama, Family",Hitesh Bhatia,"Hitesh Bhatia, Supratik Sen","Rishi Kapoor, Paresh Rawal, Juhi Chawla","B. G. Sharma is a 58-year old widower, and a middle-class man, living in West Delhi. One fine day, the company he has worked for his entire life lays him off. Sharma struggles to cope with this beast called retirement. He keeps finding ways to stay relevant but only ends up getting in his two sons' ways. The only time he really comes into his own is when he is in the kitchen. He is a cook nonpareil, waiting to be discovered, not yet fully aware of his culinary superpower.",Hindi,India,2 wins & 2 nominations,https://m.media-amazon.com/images/M/MV5BY2MxNjVlNjMtOGExMi00NWRjLThhYzQtNDY4OWZkMzcwNjhiXkEyXkFqcGdeQXVyMTI1NDEyNTM5._V1_SX300.jpg,"[{'Source': 'Internet Movie Database', 'Value': '7.5/10'}, {'Source': 'Rotten Tomatoes', 'Value': '92%'}]",N/A,7.5,"11,153",tt9098938,movie,N/A,N/A,N/A,N/A,True
Music School,2023,N/A,12 May 2023,125 min,"Drama, Musical",Paparao Biyyala,"Paparao Biyyala, Aripirala Satyaprasad, Shivani Tibrewala","Shriya Saran, Prakash Raj, Sharman Joshi","""Music School"" is an eleven song Musical film composed by Ilaiyaraaja. This heart warming and endearing film is about two contemporary and creative teachers, Mary D'Cruz and Manoj who provide a glimpse of the rich culture and refinement of music and theatre to students who are driven by an unimaginative educational system in the name of Math, Science and Technology.","Hindi, Tamil, Telugu",India,N/A,https://m.media-amazon.com/images/M/MV5BMmZmYzQwMDItYzc3MS00NzYwLWJiNjYtNmZiNmJjNWM2MjYwXkEyXkFqcGdeQXVyMTEyNzI3ODMz._V1_SX300.jpg,"[{'Source': 'Internet Movie Database', 'Value': '6.3/10'}]",N/A,6.3,702,tt11680920,movie,N/A,N/A,N/A,N/A,True
Satyameva Jayate 2,2021,N/A,25 Nov 2021,138 min,"Action, Crime, Drama",Milap Zaveri,Milap Zaveri,"John Abraham, Divya Khosla Kumar, Harsh Chhaya","Satya Balram Azaad proposes Lokpal bill in the parliament but due to lack of votes his plea gets rejected ,years ago his father Dadasaheb Balram Azad had had scarified his life for the same which also left his mother Suhasini in coma.A killer starts to kill corrupt people in the city to stop corruption so the officials decide to appoint a tough cop Jay Balram Azad twin brother of Satya.Jay is known to punish criminals without giving them a chance as soon as he takes the case gets call from the killer warning him to stay away from everything and the killer his none other then Satya who in the day is a politician while in the dark punishes the corrupts.Both brother on different side of law faith will bring them opposite each other in a battle of justice.",Hindi,India,1 win,https://m.media-amazon.com/images/M/MV5BNTg3ZWEzZjctMzY1NC00MjI2LWIwMjktZTM0YzE0NjY5OWY3XkEyXkFqcGdeQXVyODE5NzE3OTE@._V1_SX300.jpg,"[{'Source': 'Internet Movie Database', 'Value': '4.1/10'}]",N/A,4.1,"16,072",tt10739666,movie,N/A,N/A,N/A,N/A,True
Laal Kaptaan,2019,Not Rated,18 Oct 2019,155 min,"Action, Adventure, Drama",Navdeep Singh,"Abdul Rafay Chandio, Sudip Sharma, Navdeep Singh","Saif Ali Khan, Zoya Hussain, Manav Vij","The film will feature Saif in the role of a ""naga sadhu"" out on a journey ridden with drama, revenge and deceit. ""Saif is a gifted actor and this script allows him to showcase his talent like never before. Laal Kaptaan boasts of a larger-than-life landscape, dramatic characters and a gripping story that makes it a first of its kind. NH 10 Director Navdeep Singh has directed the movie.",Hindi,India,1 win & 5 nominations,https://m.media-amazon.com/images/M/MV5BNzE4NDMzNWEtNTNiOC00YjBlLWE0MjQtZTFkMzY2NjZiNGFkXkEyXkFqcGdeQXVyNDY5MTUyNjU@._V1_SX300.jpg,"[{'Source': 'Internet Movie Database', 'Value': '7.2/10'}, {'Source': 'Rotten Tomatoes', 'Value': '11%'}]",N/A,7.2,"5,322",tt9052960,movie,10 Jun 2020,N/A,N/A,N/A,True
Manto,2018,N/A,21 Sep 2018,112 min,"Biography, Drama",Nandita Das,Nandita Das,"Nawazuddin Siddiqui, Rasika Dugal, Tahir Raj Bhasin",The film is a biographical account of writer Saadat Hasan Manto's life and is set in 1940s India.,"Hindi, Urdu","India, France, United States",3 wins & 22 nominations,https://m.media-amazon.com/images/M/MV5BZjIxZTllYjUtNzJjNy00YWNlLWE3NmItMTk0ZDMxOGVlMDhjXkEyXkFqcGdeQXVyODE5NzE3OTE@._V1_SX300.jpg,"[{'Source': 'Internet Movie Database', 'Value': '7.3/10'}, {'Source': 'Rotten Tomatoes', 'Value': '74%'}]",N/A,7.3,"4,618",tt6923462,movie,22 Jun 2020,N/A,N/A,N/A,True
Khakee,2004,Not Rated,23 Jan 2004,174 min,"Action, Crime, Drama",Rajkumar Santoshi,"Ranjit Kapoor, Shridhar Raghavan, Rajkumar Santoshi","Amitabh Bachchan, Akshay Kumar, Ajay Devgn","DCP Anant Shrivastav (Amitabh Bachchan) has been assigned the mission to escort terrorist Iqbal Ansari (Atul Kulkarni) from Chandangarh to Mumbai. His terrorist organization are determined to obtain him again. The plan for this is led by Yashwant Angre (Ajay Devgan), a ruthless killer and a former police officer. Anant's team consists of Inspector Shekhar Sachdev (Akshay Kumar), rookie cop Ashwin Gupte (Tusshar Kapoor) and two more inspectors. Soon Mahalakshmi (Aishwarya Rai) joins them as she is the only witness to have seen Yashwant. The team are armed and ready to go but danger lurks everywhere as the terrorist organization are determined to make sure the officers do not make it to Mumbai. The trip turns into survival when the team are attacked at various times. Finally the team make it to an abandoned cottage in the forest but there is a shoot out and the team are heavily outnumbered. Shekhar tries to force an exchange but against Anant's and Ashwin's judgement. Finally Ansari, after weeks of frustration, reveals that the terrorists are also out to kill him. He reveals a corrupt world involving the police and politicians. The officers soon realize the enemy they have been fighting is closer to them...In the end, Shekhar is killed by Mahalakshmi and her associate Angre. This killing spites anger into Anant and he hunts down each one of the corrupt officers and in the end, captures Angre after a fight during which, Despite Anant needing his medication often, he wins, and Angre is successfully captured. The movie ends as Angre is tried and sentenced to prison, and is being carried to his sentence; when he decides to flee, as a nut is lose in the bar to which he is handcuffed in the police van. Angre has Ashwin on gun point using a constable's rifle, when Ashwin reveals that Angre's lose nut was a setup to allow the killing of Angre, and that the bullets of the rifle had been emptied. Ashwin then shoots Angre, and reports his death as murder in an encounter.",Hindi,India,2 wins & 33 nominations,https://m.media-amazon.com/images/M/MV5BN2NhOGZlNzYtYmYxMS00YTk1LTk2MDItNjI3MDVlZTRkZDYwXkEyXkFqcGdeQXVyODE5NzE3OTE@._V1_SX300.jpg,"[{'Source': 'Internet Movie Database', 'Value': '7.4/10'}, {'Source': 'Rotten Tomatoes', 'Value': '100%'}]",N/A,7.4,"16,504",tt0347332,movie,20 Jun 2017,"$587,877",N/A,N/A,True
Yeh Saali Aashiqui,2019,N/A,29 Nov 2019,137 min,"Drama, Romance, Thriller",Cherag Ruparel,"Vardhan Puri, Cherag Ruparel","Vardhan Puri, Shivaleeka Oberoi, Ruslaan Mumtaz","When Sahil met Mittee in hotel management school, it was love at first sight for both of them. Their love was everything - picture perfect and flawless. But an unlikely event at school turns their dream-come-true romance into a nightmare and makes them realise how important it is to know your partner thoroughly before getting into any kind of romantic relationship.",Hindi,India,5 nominations,https://m.media-amazon.com/images/M/MV5BNTcyNGNjNGYtYWVjZi00MWEwLThlNjctOWM3NDYxYmM0MWMxXkEyXkFqcGdeQXVyODE5NzE3OTE@._V1_SX300.jpg,"[{'Source': 'Internet Movie Database', 'Value': '7.8/10'}]",N/A,7.8,"4,519",tt10443846,movie,N/A,N/A,N/A,N/A,True
Lakshya,2004,Not Rated,18 Jun 2004,186 min,"Action, Drama, Romance",Farhan Akhtar,"Javed Akhtar, Karan Kashyap, Karan Vishwanath Kashyap","Hrithik Roshan, Preity G Zinta, Amitabh Bachchan","Karan, a spoiled teenager, joins the Indian Army on a whim but backs out when he finds a soldier's life to be difficult. When this creates conflict with his girlfriend, he reenlists and proves his mettle by becoming an officer just as war breaks out.",Hindi,India,6 wins & 15 nominations,https://m.media-amazon.com/images/M/MV5BY2Y0NjY5ZTctZWMzNC00MDQ4LTkyMWUtOGZkMzk4NWNhYWI5XkEyXkFqcGdeQXVyODE5NzE3OTE@._V1_SX300.jpg,"[{'Source': 'Internet Movie Database', 'Value': '7.8/10'}]",N/A,7.8,"25,450",tt0323013,movie,20 Nov 2016,"$753,600",N/A,N/A,True
Badhaai Ho,2018,Not Rated,19 Oct 2018,124 min,"Comedy, Drama",Amit Ravindernath Sharma,"Akshat Ghildial, Jyoti Kapoor, Shantanu Srivastava","Ayushmann Khurrana, Neena Gupta, Gajraj Rao","Nakul a 25 year old in relationship with Renne and soon plan to marry .His father Jeetender Kaushik works for railways while mother Priyamvada is housewife whose always taunted by his grandmother.When Nakul finds that his mother is pregnant at the age when Nakul is about to marry he starts to avoid their parents ,friends and society.",Hindi,India,27 wins & 38 nominations,https://m.media-amazon.com/images/M/MV5BNjZlMDdmN2YtYThmZi00NGQzLTk0ZTQtNTUyZDFmODExOGNiXkEyXkFqcGdeQXVyODE5NzE3OTE@._V1_SX300.jpg,"[{'Source': 'Internet Movie Database', 'Value': '7.9/10'}, {'Source': 'Rotten Tomatoes', 'Value': '92%'}]",N/A,7.9,"37,941",tt7725596,movie,N/A,N/A,N/A,N/A,True
Trishna,2011,R,09 Mar 2012,117 min,Drama,Michael Winterbottom,"Michael Winterbottom, Thomas Hardy","Freida Pinto, Riz Ahmed, Mita Vashisht","Based on Thomas Hardy's classic novel Tess of the D'Urbervilles, 'Trishna' tells the story of one woman whose life is destroyed by a combination of love and circumstances. Set in contemporary Rajasthan, Trishna (Freida Pinto) meets a wealthy young British businessman Jay Singh (Riz Ahmed) who has come to India to work in his father's hotel business. After an accident destroys her father's Jeep, Trishna goes to work for Jay, and they fall in love. But despite their feelings for each other, they cannot escape the conflicting pressures of a rural society which is changing rapidly through industrialisation, urbanisation and, above all, education. Trishna's tragedy is that she is torn between the traditions of her family life and the dreams and ambitions that her education has given her.","English, Hindi, Punjabi, Rajasthani","United Kingdom, Sweden, India",4 nominations,https://m.media-amazon.com/images/M/MV5BMTkxMTU0MTY1M15BMl5BanBnXkFtZTcwMTExMjc3Nw@@._V1_SX300.jpg,"[{'Source': 'Internet Movie Database', 'Value': '6.0/10'}, {'Source': 'Rotten Tomatoes', 'Value': '63%'}, {'Source': 'Metacritic', 'Value': '57/100'}]",57,6.0,"3,286",tt1836987,movie,30 Mar 2016,"$240,381",N/A,N/A,True
Guilty,2020,TV-MA,06 Mar 2020,119 min,"Drama, Thriller",Ruchi Narain,"Atika Chohan, Kanika Dhillon, Ruchi Narain","Kiara Advani, Taher Shabbir, Akansha Ranjan Kapoor","When a college heartthrob is accused of rape by a less popular student, his girlfriend navigates various versions of the story in search of the truth.","Hindi, English",India,6 wins & 6 nominations,https://m.media-amazon.com/images/M/MV5BYWYxMjBlZjEtY2ZkYS00OWE1LWEzNTAtNDlkZWE5NzI1NDE1XkEyXkFqcGdeQXVyMTA5NzIyMDY5._V1_SX300.jpg,"[{'Source': 'Internet Movie Database', 'Value': '5.4/10'}, {'Source': 'Rotten Tomatoes', 'Value': '50%'}]",N/A,5.4,"4,726",tt10062614,movie,10 Mar 2020,N/A,N/A,N/A,True
Thank God,2022,N/A,25 Oct 2022,121 min,"Comedy, Fantasy",Indra Kumar,"Aakash Kaushik, Anders Matthesen, Samuthirakani","Sidharth Malhotra, Ajay Devgn, Rakul Preet Singh","An egoistic real estate broker in huge debts, meets with an accident.God appears in front of him and informs him that he will have to play a ""GAME OF LIFE"". If he win, he will be sent back to earth and if not, he will be sent to h...",Hindi,India,2 nominations,https://m.media-amazon.com/images/M/MV5BMDc0NzU5MzMtNDFkMC00MTNkLWE2MzMtMmYwMzdkY2EzZDVhXkEyXkFqcGdeQXVyMTE0MTY2Mzk2._V1_SX300.jpg,"[{'Source': 'Internet Movie Database', 'Value': '5.6/10'}, {'Source': 'Rotten Tomatoes', 'Value': '29%'}]",N/A,5.6,"12,222",tt13795296,movie,N/A,N/A,N/A,N/A,True
Ghayal,1990,Not Rated,22 Jun 1990,163 min,"Action, Crime, Drama",Rajkumar Santoshi,"Nasir Adib, Lateef Binny, Vijay Deveshwar","Sunny Deol, Amrish Puri, Meenakshi Sheshadri","Ajay Mehra lives with his elder brother Ashok and sister-in-law Indu. He leaves for Bangalore in order to train to become an international boxer. On his return to New Delhi, he finds that Ashok is missing. He lodges a complaint at the police station but to no avail. He decides to search for his brother himself but still does not find him. Later on, Ashok's body is found and Ajay is accused of killing him as well as having an illicit relationship with his sister-in-law. While in jail, Ajay makes friends with some other hardcore convicts, who are good at heart. Then one day, they escape the jail by overpowering the guards. Ajay only has one thing on his mind: to kill Balwant Rai, a wealthy, powerful and corrupt businessman who had used Ashok's business as a front for his illegal activities. Ajay's new friends and his love interest Varsha, a journalist, help him in his mission.",Hindi,India,9 wins & 1 nomination,https://m.media-amazon.com/images/M/MV5BM2NiZmQzMDgtNThhZi00NWUzLTk4NmItYmY5MTNkZTU5ZWU1XkEyXkFqcGdeQXVyODE5NzE3OTE@._V1_SX300.jpg,"[{'Source': 'Internet Movie Database', 'Value': '7.7/10'}]",N/A,7.7,"5,048",tt0099652,movie,17 Mar 2017,N/A,N/A,N/A,True
Baaghi,2016,Not Rated,29 Apr 2016,133 min,"Action, Romance, Thriller",Sabbir Khan,"Shifuji Shaurya Bharadwaj, Sanjeev Datta, Sanjeev Dutta","Tiger Shroff, Shraddha Kapoor, Sudheer Babu Posani",A martial arts student seeks revenge after the murder of his master.,Hindi,India,3 wins & 5 nominations,https://m.media-amazon.com/images/M/MV5BMDlhYzBmYjgtYzkyMC00MDUwLTkwNzgtYzk4Yjc5ZTU1ODI3XkEyXkFqcGdeQXVyODE5NzE3OTE@._V1_SX300.jpg,"[{'Source': 'Internet Movie Database', 'Value': '5.3/10'}, {'Source': 'Rotten Tomatoes', 'Value': '30%'}]",N/A,5.3,"9,929",tt4864932,movie,N/A,"$438,207",N/A,N/A,True
Bombay Velvet,2015,Not Rated,15 May 2015,149 min,"Action, Crime, Drama",Anurag Kashyap,"Vasan Bala, Anurag Kashyap, Gyan Prakash","Ranbir Kapoor, Anushka Sharma, Karan Johar","Set against the backdrop of ambition, love, greed, and jazz - Bombay Velvet is the story of one ordinary man who goes against all odds and forges his destiny to become a 'Big Shot'. Jazz clubs, a passionate love story, a growing metropolis and a phenomenal hunger for a good life. Welcome to the City of Dreams. Welcome to Bombay Velvet.",Hindi,India,5 wins & 3 nominations,https://m.media-amazon.com/images/M/MV5BMTYwNzNkODUtZmYyMC00ZDMwLWI4OTktZWJiODk2ZjA3OTdkXkEyXkFqcGdeQXVyODE5NzE3OTE@._V1_SX300.jpg,"[{'Source': 'Internet Movie Database', 'Value': '5.5/10'}, {'Source': 'Rotten Tomatoes', 'Value': '42%'}]",N/A,5.5,"6,403",tt2979920,movie,04 Apr 2017,"$450,692",N/A,N/A,True
Once Upon a Time in Mumbaai Dobara,2013,Not Rated,15 Aug 2013,160 min,"Action, Crime, Drama",Milan Luthria,"Rajat Arora, Aditi Mediratta","Akshay Kumar, Imran Khan, Sonakshi Sinha","The story of Shoaib, an underworld don who came to power by killing his mentor and has extended his kingdom with the help of his best friend, Javed, and his former lover, Mumtaz. While visiting the area where he grew up, he meets Aslam, who becomes his accomplice.","Hindi, Marathi, English",India,3 wins & 2 nominations,https://m.media-amazon.com/images/M/MV5BNWE0ZWNhOTYtMDEyYS00OWE4LWIwNmEtZjdmN2Y2ODY2NGI2XkEyXkFqcGdeQXVyODE5NzE3OTE@._V1_SX300.jpg,"[{'Source': 'Internet Movie Database', 'Value': '4.4/10'}]",N/A,4.4,"7,605",tt1891884,movie,11 Nov 2016,N/A,N/A,N/A,True
Shaadi Mein Zaroor Aana,2017,N/A,10 Nov 2017,137 min,"Drama, Romance",Ratnaa Sinha,Kamal Pandey,"Rajkummar Rao, Kriti Kharbanda, K.K. Raina","Satyendra aka Sattu (Rajkummar Rao) and Aarti (Kriti Kharbanda) meet for a proposed arranged marriage and fall in love in the process. On the night of their marriage, an unexpected turn of events turns their world upside down. Set in the backdrop of India's civil services, Shaadi Mein Zaroor Aana explores the challenges that Satyendra and Aarti face as a middle-class couple in India.",Hindi,India,2 wins,https://m.media-amazon.com/images/M/MV5BODFkMDRjMWQtNDllMC00NjMwLWFlYzQtMWY5YWFkM2Y1NzhlXkEyXkFqcGdeQXVyNzkxOTEyMjI@._V1_SX300.jpg,"[{'Source': 'Internet Movie Database', 'Value': '7.5/10'}, {'Source': 'Rotten Tomatoes', 'Value': '22%'}]",N/A,7.5,"17,284",tt7469726,movie,N/A,N/A,N/A,N/A,True
Lage Raho Munna Bhai,2006,Not Rated,01 Sep 2006,144 min,"Comedy, Drama, Romance",Rajkumar Hirani,"Vidhu Vinod Chopra, Rajkumar Hirani, Abhijat Joshi","Sanjay Dutt, Arshad Warsi, Vidya Balan","A hilarious underworld gangster known as Munna Bhai falls comically in love with a radio host by the name of Jahnvi, who runs an elders' home, which is taken over by an unscrupulous builder, who gets the residents kicked out ironically with the help of Munna's sidekick, Circuit, while Munna is busy romancing Jahnvi elsewhere. Munna, who is now masquerading as a Professor specializing in the life of Mahatma Gandhi, must now battle his very own forces and the builder - but he has one ally on his side - none other than the great man - Mahatma Gandhi himself. Only trouble is that Munna may have problems convincing everyone about this presence - as he is apparently is the only one who can see and hear him.",Hindi,India,31 wins & 31 nominations,https://m.media-amazon.com/images/M/MV5BN2ZmMDMwODgtMzA5MS00MGU0LWEyYTgtYzQ5MmQzMzU2NTVkXkEyXkFqcGdeQXVyODE5NzE3OTE@._V1_SX300.jpg,"[{'Source': 'Internet Movie Database', 'Value': '8.0/10'}]",N/A,8.0,"49,977",tt0456144,movie,16 Mar 2016,"$2,217,562",N/A,N/A,True
Luka Chuppi,2019,Not Rated,01 Mar 2019,126 min,"Comedy, Romance",Laxman Utekar,Rohan Shankar,"Kartik Aaryan, Kriti Sanon, Aparshakti Khurana","Vinod ""Guddu"" Shukla is a television reporter in Mathura. He falls for the headstrong Rashmi Trivedi. Guddu wants to get married but Rashmi suggests a live-in relationship. They decide to try the live-in relationship when both their traditional families assume they're married and start living with them.",Hindi,India,2 wins & 5 nominations,https://m.media-amazon.com/images/M/MV5BY2MwM2ZhNTItMzkwNi00MTQxLTljMDAtZTk1YmU2M2YzNGVmXkEyXkFqcGdeQXVyNjE1OTQ0NjA@._V1_SX300.jpg,"[{'Source': 'Internet Movie Database', 'Value': '6.4/10'}, {'Source': 'Rotten Tomatoes', 'Value': '31%'}]",N/A,6.4,"13,220",tt8908002,movie,07 Jun 2019,"$1,042,905",N/A,N/A,True
Shor in the City,2010,N/A,28 Apr 2011,112 min,"Crime, Drama","Krishna D.K., Raj Nidimoru","Krishna D.K., Raj Nidimoru, Sita Menon","Tusshar Kapoor, Sendhil Ramamurthy, Nikhil Dwivedi","An NRI faces threats from extortionists when he opens a small business and goes out with an aspiring model. He refuses to pay, both are stalked, and when he complains to the police, they not only shrug it off but offer 'protection' for a price. With increasing pressure, he must now make a decision to re-locate or submit to their demands. Tilak and his friends are career criminals, and sell merchandise that they steal from passengers using public transportation. He also buys best-selling novels, has copies printed, and has them sold at busy traffic signals. Things change when his group find guns and an explosive device in a stolen bag. Sawan Murthy wants to be a cricketer and must come up with Rs.10 Lakhs in order to be inducted in the 20/20 team. He has no money, nobody will lend him any, and he considers robbing the Citizen's Co-operative Bank. Just some of the challenges faced by regular Mumbaites and criminals in this crime-laden city.","Hindi, Marathi, English",India,2 wins & 15 nominations,https://m.media-amazon.com/images/M/MV5BNzQwNzA2ZTEtNjM0MC00ZTQ1LWE4MTUtN2M3MDEyMWM5MzdkXkEyXkFqcGdeQXVyODE5NzE3OTE@._V1_SX300.jpg,"[{'Source': 'Internet Movie Database', 'Value': '7.2/10'}]",N/A,7.2,"4,064",tt1916728,movie,11 Mar 2017,N/A,N/A,N/A,True
Tanhaji: The Unsung Warrior,2020,Not Rated,10 Jan 2020,135 min,"Action, Biography, Drama",Om Raut,"Prakash Kapadia, Om Raut, Kirti Deghatak","Ajay Devgn, Saif Ali Khan, Sharad Kelkar","Tanhaji is an action epic about the titular Maratha warrior and Shivaji's military commander who lost his father in a battle and grew up to become a fierce warrior with powerful combat skills. When Mughal emperor Aurangzeb recruits his trusted guard Udaybhan to take control of the Kondhana Fort, Shivaji decides not to engage Tanhaji whose son is going to get married soon. However, as Tanhaji learns of Udaybhan's heading towards the fortress, he decides to take charge and stop the rival army from reaching their destination. This doesn't turn out to be easy as Udaybhan finds himself helped by people who don't want Tanhaji to succeed, resulting in battles and attacks that ensue as the plot unfolds.",Hindi,India,16 wins & 28 nominations,https://m.media-amazon.com/images/M/MV5BMDc5ZmQ3MzUtYTY4OS00YTE3LTkwNmItNmQ2ODIwNWM3MzY1XkEyXkFqcGdeQXVyODE5NzE3OTE@._V1_SX300.jpg,"[{'Source': 'Internet Movie Database', 'Value': '7.5/10'}, {'Source': 'Rotten Tomatoes', 'Value': '75%'}]",N/A,7.5,"35,782",tt8108274,movie,N/A,N/A,N/A,N/A,True
Neymar,2023,N/A,12 May 2023,160 min,"Comedy, Family",Sudhi Maddison,"Sudhi Maddison, Paulson Skaria, Adarsh Sukumaran","Mathew Thomas, Vijayaraghavan, Johny Antony",Kunjava and his friend Sinto bring a new furry friend named Neymar into their lives. Little did they know that their lives were about to be turned upside down.,"Malayalam, Telugu, Hindi, Tamil",India,N/A,https://m.media-amazon.com/images/M/MV5BNzkyNzMxNGMtOGI5OS00ZTk4LWE1ZWYtZTIwNDA1OTNlOTc5XkEyXkFqcGdeQXVyMjkxNzQ1NDI@._V1_SX300.jpg,"[{'Source': 'Internet Movie Database', 'Value': '6.4/10'}]",N/A,6.4,893,tt18250130,movie,N/A,N/A,N/A,N/A,True
