Title,Year,Rated,Released,Runtime,Genre,Director,Writer,Actors,Plot,Language,Country,Awards,Poster,Ratings,Metascore,imdbRating,imdbVotes,imdbID,Type,DVD,BoxOffice,Production,Website,Response
Dum Laga Ke Haisha,2015,Not Rated,27 Feb 2015,109 min,"Comedy, Drama, Romance",Sharat Katariya,Sharat Katariya,"Bhumi Pednekar, Ayushmann Khurrana, Sanjay Mishra","It is the 1990s, the tape-cassette is dying, CDs will soon be the rage and a regular arranged marriage will turn out to be a perfect mismatch. Prem (Ayushmann Khurrana) is a shy music buff who runs a tape recording shop in Haridwar. Sandhya (Bhumi Pednekar) likes to dance to the band tunes at her own wedding. He has nightmares about drawing a blank at his English exam. She is about to carve a niche for herself as a teacher. But now, they are married and they are supposed to spend a lifetime together - and he is still trying to find balance on their scooter ride together. From overcoming his fear of the English language to dealing with an overbearing father, he discovers that his oversized wife, who he thought was a spanner in his spool, will actually lead him to something quite cool.",Hindi,India,28 wins & 28 nominations,https://m.media-amazon.com/images/M/MV5BMTU4NDY2NjgxOV5BMl5BanBnXkFtZTgwMjk2NTYyNTM@._V1_SX300.jpg,"[{'Source': 'Internet Movie Database', 'Value': '7.5/10'}, {'Source': 'Rotten Tomatoes', 'Value': '93%'}]",N/A,7.5,"20,891",tt3495030,movie,16 Dec 2015,N/A,N/A,N/A,True
Fukrey Returns,2017,Not Rated,08 Dec 2017,141 min,Comedy,Mrighdeep Lamba,"Vipul Vig, Mrighdeep Lamba","Pulkit Samrat, Varun Sharma, Ali Fazal","After sending Bholi Punjaban in jail Fukrey Boys Hunny,Choocha,Zafar and Lali are doing well their success in life still depends on Choocha's dreams.A frustrated Bholi is in jail since a year and cant arrange for her bail as her criminal activities have stopped and there is no source of income.Bholi contacts minister Babulal Bhatia to bail her out in returns Babulal tells her that she should pay him 10 Crore within 10 days of her release or else on 11th day she will be back in jail.Bholi tracks Hunny,Choocha,Zafar and Lali and tells them as they were responsible for her arrest they should arrange the bail amount by opening a fraud finance company which will benefit them as well as the people.But Babulal plays a part and puts the company into losses.Fukrey Boys now are on the run to save their lives from Bholi as well as the people who have invested in the company.",Hindi,India,N/A,https://m.media-amazon.com/images/M/MV5BYmUyYzI5MjEtZGU5Mi00YTFiLWJmYjMtOWFmMzlmNTdmZTdjXkEyXkFqcGdeQXVyNzU3OTY4NTc@._V1_SX300.jpg,"[{'Source': 'Internet Movie Database', 'Value': '6.5/10'}, {'Source': 'Rotten Tomatoes', 'Value': '11%'}]",N/A,6.5,"6,348",tt6712014,movie,27 Jun 2018,N/A,N/A,N/A,True
The Villain,2014,Not Rated,27 Jun 2014,129 min,"Action, Crime, Drama",Mohit Suri,"Tushar Hiranandani, Milap Zaveri","Sidharth Malhotra, Shraddha Kapoor, Riteish Deshmukh","Every love story has a hero, a heroine, and a villain. But this is the love story of a villain. Guru is a quiet, tough, and ruthless man, who works for a crooked politician. A dark past refuses to let Guru sleep at night until he meets Aisha. He falls in love with her and his life changes. Just when things seem perfect, she falls prey to an attack. Devastated, Guru starts hunting the miscreant and is shocked to learn of his seemingly innocuous and simple identity. Does Guru succeed in getting even with the assailant? And what is the motive behind the killings? The plot thickens as the astonishing mystery unveils and new realizations come to the forefront.",Hindi,India,18 wins & 23 nominations,https://m.media-amazon.com/images/M/MV5BMTQzODMxNDU3MF5BMl5BanBnXkFtZTgwMDAzNjMxMjE@._V1_SX300.jpg,"[{'Source': 'Internet Movie Database', 'Value': '6.6/10'}]",N/A,6.6,"22,392",tt3175038,movie,05 Nov 2015,"$730,530",N/A,N/A,True
Kick,2014,Not Rated,25 Jul 2014,146 min,"Action, Comedy, Crime",Sajid Nadiadwala,"Vakkantham Vamsi, Rajat Arora, Keith Gomes","Salman Khan, Jacqueline Fernandez, Nawazuddin Siddiqui","On a train journey in Warsaw, psychiatrist Shaina meets Himanshu, who is a police officer from India to discuss their prospective marriage. Both are reluctant to enter into an arranged union but become friends and strike a deep conversation where Shaina reveals her previous relationship with the eccentric Devi, a man who lived only for his 'Kick' aka an adrenaline rush . Despite his idiosyncrasies they embark on a whirlwind romance, until one day he breaks up with her for a new 'Kick' and walks away never to return. Himanshu in turn regales her with his glorious escapades as an officer but mentions that he has finally met his match, an intelligent thief. What they are both unaware of is that their stories have one thing in common, Devi. He returns to their lives under the pretext of having lost his memory. Behind it all, is a deeper mystery and an uncompromising mission for which Devi is ready to lose his life.",Hindi,India,13 wins & 26 nominations,https://m.media-amazon.com/images/M/MV5BMTUyMTg0MTA1OF5BMl5BanBnXkFtZTgwMDg2MjMwMjE@._V1_SX300.jpg,"[{'Source': 'Internet Movie Database', 'Value': '6.0/10'}, {'Source': 'Rotten Tomatoes', 'Value': '43%'}]",N/A,6.0,"72,454",tt2372222,movie,16 Jan 2018,"$2,472,695",N/A,N/A,True
Shaitan,2011,Not Rated,10 Jun 2011,121 min,"Action, Crime, Drama",Bejoy Nambiar,"Abhijeet Shirish Deshpande, K.S. Krishnan, Bejoy Nambiar","Kalki Koechlin, Shiv Panditt, Gulshan Devaiah","After the passing of her mother, and the entry of a step-mother, Amrita Jayshankar retreats into herself. Her father is summoned to her school and is told that his daughter may require counseling, but he refuses to believe and instead makes a donation to the school. Then Amrita meets with three males and a female, namely Zuben, Dushant Sahu, Karan Chaudhary; and Tanya Sharma respectively. Together they live it up with drugs and alcohol until things get out of control when they accidentally kill a couple. A corrupt police constable demands Rs.25 Lakhs to eliminate their involvement. Unable to come up with so much cash, the five decide to fake a kidnapping, demand the cash from Amrita's father, and clear their respective names. Amrita accordingly goes 'missing', and her father involves the police, who assign this case to once-suspended police inspector, Arvind Mathur. With the media getting involved, Arvind begins his investigation, but will soon find it hampered - complicating not only his assignment - but also his personal life.","Hindi, English",India,3 wins & 15 nominations,https://m.media-amazon.com/images/M/MV5BNDJiNDQxYWUtNTM2Mi00MDg3LWI5NTYtNjU1NmVmNmYwNTE5XkEyXkFqcGdeQXVyNDUzOTQ5MjY@._V1_SX300.jpg,"[{'Source': 'Internet Movie Database', 'Value': '7.2/10'}]",N/A,7.2,"8,909",tt1836912,movie,29 Sep 2016,N/A,N/A,N/A,True
Raksha Bandhan,2022,N/A,11 Aug 2022,108 min,"Comedy, Drama, Family",Aanand L. Rai,"Kanika Dhillon, Himanshu Sharma","Akshay Kumar, Bhumi Pednekar, Sadia Khateeb","Lala Kedarnath promises his dying mother to marry his 4 sisters well. Owner of family chat shop, he has trouble finding suitors. His sisters take priority over childhood romance with Sapna.",Hindi,India,1 nomination,https://m.media-amazon.com/images/M/MV5BNGVhNTQzNDgtZTE3ZS00NmY4LWE0NzktMWI5ODAyOTBjMTk5XkEyXkFqcGdeQXVyMTIyNzY0NTMx._V1_SX300.jpg,"[{'Source': 'Internet Movie Database', 'Value': '5.3/10'}, {'Source': 'Rotten Tomatoes', 'Value': '18%'}]",N/A,5.3,"26,547",tt12834962,movie,N/A,N/A,N/A,N/A,True
2.0,2018,Not Rated,29 Nov 2018,148 min,"Action, Sci-Fi, Thriller",S. Shankar,"Jayamohan, Lakshmi Saravanakumar, S. Shankar","Rajinikanth, Akshay Kumar, Amy Jackson",8 years after Chitti was dismantled due to destruction he caused. Vaseegaran has created new human robot Nila which can understand human feelings better. The cell phones in the city start to disappear from everywhere. A creature in the form of bird creates havoc in the city causing destruction. Vaseegaran believes it to be the fifth element force and decides to get Chitti back in action. When Vaseegaran traces the location of missing cellphones with help of Chitti and Nila he finds that its not the fifth force but a human force done by late professor Pakshi Rajan.,"Hindi, Tamil",India,3 wins & 8 nominations,https://m.media-amazon.com/images/M/MV5BMjU0ZDA3ZDYtMzVkMS00Y2Y3LWFiOGQtNmMwNzQ4MDY2NzVhXkEyXkFqcGdeQXVyODIwMDI1NjM@._V1_SX300.jpg,"[{'Source': 'Internet Movie Database', 'Value': '6.0/10'}, {'Source': 'Rotten Tomatoes', 'Value': '55%'}]",N/A,6.0,"26,940",tt5080556,movie,25 Apr 2019,"$4,152,000",N/A,N/A,True
Cuttputlli,2022,N/A,N/A,120 min,"Crime, Drama, Mystery",Ranjit Tewari,"Aseem Arrora, Vashu Bhagnani","Akshay Kumar, Rakul Preet Singh, Sargun Mehta","When a small town gets plunged into the nightmare of serial killings, rookie cop Arjan embarks on a chase for the truth and unravels a gruesome conspiracy.",Hindi,India,2 wins & 2 nominations,https://m.media-amazon.com/images/M/MV5BNTViNThkYWEtMzY4Zi00YWVkLThmMDYtYzUzYzZlOGRhNDlmXkEyXkFqcGdeQXVyODE5NzE3OTE@._V1_SX300.jpg,"[{'Source': 'Internet Movie Database', 'Value': '5.7/10'}]",N/A,5.7,"22,092",tt15315164,movie,N/A,N/A,N/A,N/A,True
Housefull 5,2025,N/A,06 Jun 2025,N/A,"Comedy, Drama",Tarun Mansukhani,Sajid Nadiadwala,"Akshay Kumar, Kriti Sanon, Jacqueline Fernandez",Fifth installment of Housefull film series.,Hindi,India,N/A,https://m.media-amazon.com/images/M/MV5BMjNmMWYxZTktNDJjZi00NjUyLThjYWMtYTUwZDM3ZDdhYjg0XkEyXkFqcGdeQXVyNjUwMjYwMjE@._V1_SX300.jpg,[],N/A,N/A,N/A,tt9104736,movie,N/A,N/A,N/A,N/A,True
Kabhi Haan Kabhi Naa,1994,N/A,25 Feb 1994,158 min,"Comedy, Drama, Music",Kundan Shah,"Pankaj Advani, Ranjit Kapoor, Kundan Shah","Shah Rukh Khan, Suchitra Krishnamoorthi, Deepak Tijori",Sunil and some of his friends start a band and perform at weddings and special occasions. Sunil is in love with Aana but Aana loves Chris; when Sunil finds out about this he decides to utilize the best of his powers to prevent the couple from meeting only to stand exposed in the eyes of Aana who throws him out from the music band. He finds an opportunity coming his way when Chris' parents arrange his marriage elsewhere but another calamity occurs when when Chris finds out that he failed his exam forcing him to forge a certificate which states that he is successful at the exam in the eyes of his parents.,"Hindi, English",India,2 wins,https://m.media-amazon.com/images/M/MV5BYmFjYTRmMzctNWU5YS00MjY2LTg4Y2EtZDZkMWI0YjIzMjVlXkEyXkFqcGdeQXVyODE5NzE3OTE@._V1_SX300.jpg,"[{'Source': 'Internet Movie Database', 'Value': '7.6/10'}]",N/A,7.6,"19,272",tt0110222,movie,23 Mar 2017,N/A,N/A,N/A,True
Pyaar Ka Punchnama,2011,Not Rated,20 May 2011,149 min,"Comedy, Drama, Romance",Luv Ranjan,"Luv Ranjan, Sumit Saxena, Vaibhav Suman","Kartik Aaryan, Ashish Chhipa, Raayo S. Bakhirta","Outspoken and overly critical Nishant Agarwal meets gorgeous new co-worker, Charu, offers his help, assists her financially, and they become close friends. His room-mates, Rajat and Vikrant, are pleased with this outcome as they already have girlfriends in Neha and Rhea respectively. But both the relationships are not as harmonious, as Rajat feels Neha is self-centered and demanding, while Rhea appears to be withdrawn and aloof. Missing their meetings and bar-hopping, the trio decide to take a time-out and be by themselves. All three women, however, find out and decide to accompany them to the beach where they eventually mingle. The trio do not know that soon misunderstandings will crop up - and it will take a lot of effort and understanding to resolve them.",Hindi,India,2 wins & 7 nominations,https://m.media-amazon.com/images/M/MV5BNDI4MmJkM2ItYjZjMC00MzYxLWIwZWEtYzE5YWZhYmExM2I5XkEyXkFqcGdeQXVyODE5NzE3OTE@._V1_SX300.jpg,"[{'Source': 'Internet Movie Database', 'Value': '7.6/10'}]",N/A,7.6,"22,568",tt1926313,movie,11 Mar 2017,N/A,N/A,N/A,True
Billu,2009,Not Rated,13 Feb 2009,137 min,"Comedy, Drama",Priyadarshan,"Manisha Korde, Priyadarshan, Mushtaq Shiekh","Irrfan Khan, Lara Dutta, Om Puri","Based in Budbuda, Uttar Pradesh, Billu Vilas Pardesi barely makes a living as a barber. His wife, Bindiya, looks after the household, and his children, Gunja and Ronak, are on the verge of being expelled from Gyaan Bharti Vidyalay Higher Secondary School due to non-payment of fees. Then everything changes when Bollywood actor Sahir Khan makes an appearance to film a movie in the town. Rumors spread that Billu is Sahir's close friends, and he becomes a celebrity virtually overnight. His shop gets donations and clientle, and the school decides to educate his children for free. The trouble begins when townsfolk want to meet with Sahir but Billu is unable to contact him.","Hindi, Awadhi",India,3 nominations,https://m.media-amazon.com/images/M/MV5BYWI0MGZlNWYtMmZhMS00ZDIwLTg3N2ItNTgxNWIyOTY1YTNjXkEyXkFqcGdeQXVyODE5NzE3OTE@._V1_SX300.jpg,"[{'Source': 'Internet Movie Database', 'Value': '6.4/10'}, {'Source': 'Rotten Tomatoes', 'Value': '60%'}]",N/A,6.4,"13,422",tt1230448,movie,30 Nov 2016,"$754,928",N/A,N/A,True
Jaane Tu... Ya Jaane Na,2008,N/A,04 Jul 2008,155 min,"Comedy, Drama, Romance",Abbas Tyrewala,Abbas Tyrewala,"Imran Khan, Genelia Deshmukh, Manjari Fadnnis","While on the way to the airport, Mala, who Jignesh Patel believes is going to be his future girlfriend, must listen to the romantic overtures of a group who are obsessed with the popular number 'Jaane Tu Ya Jaane Na' from the movie 'Aa Gale Lag Jaa'. The story is about Jai Singh Rathore and Aditi Wadia, two friends who are so close that the Wadias decide to get them married. But both disagree, and decide to seek soul mates for each other. With Aditi's help, Jai meets Meghna, and both fall in love with each other. Jai is introduced to her parents, who also approve of him. Aditi's is then introduced to Sushant Modi, who instantly finds approval, even with her reclusive brother, Amit. Mala anxiously awaits the climax as the story unfolds with many twists and turns.",Hindi,India,15 wins & 34 nominations,https://m.media-amazon.com/images/M/MV5BNDUxYTFiODktNDI5NC00YmI1LThiMWUtN2FjYTU2ZTQ5ODQ1XkEyXkFqcGdeQXVyODE5NzE3OTE@._V1_SX300.jpg,"[{'Source': 'Internet Movie Database', 'Value': '7.4/10'}]",N/A,7.4,"28,169",tt0473367,movie,09 Dec 2017,"$604,037",N/A,N/A,True
Dil Bechara,2020,Not Rated,24 Jul 2020,101 min,"Comedy, Drama, Romance",Mukesh Chhabra,"Shashank Khaitan, Suprotim Sengupta, Scott Neustadter","Sushant Singh Rajput, Sanjana Sanghi, Sahil Vaid","Based on the bestselling novel ""The Fault in Our Stars"" by author John Green, Dil Bechara is a story of Kizie and Manny, two ordinary people with an extraordinary love story. Both have a tragic twist to their lives. That was the start of exploring a funny, thrilling and tragic business of being alive and in love. Kizie and Manny embark on an, on and off, up and down, bitter and sweet profound journey into the heart of that crazy little thing called 'life'.",Hindi,India,8 wins & 9 nominations,https://m.media-amazon.com/images/M/MV5BNmI0MTliMTAtMmJhNC00NTJmLTllMzQtMDI3NzA1ODMyZWI1XkEyXkFqcGdeQXVyODE5NzE3OTE@._V1_SX300.jpg,"[{'Source': 'Internet Movie Database', 'Value': '8.3/10'}, {'Source': 'Rotten Tomatoes', 'Value': '87%'}]",N/A,8.3,"134,609",tt8110330,movie,19 Oct 2020,N/A,N/A,N/A,True
Hera Pheri,2000,Not Rated,31 Mar 2000,156 min,"Action, Comedy, Crime",Priyadarshan,"Siddique, Lal, Neeraj Vora","Akshay Kumar, Suniel Shetty, Paresh Rawal","Baburao is a landlord in India, who is very near-sighted, and always in financial trouble. He has a tenant named Raja, who has not paid his rent for several months. He also has anther tenant named Shyam, who has come to the city to look for a job in his late father's place, but is unable to find employment. The three men quarrel amongst themselves frequently. Then one day, the three men get a phone call from a kidnapper named Kabira, and decide to make use of this phone call to overcome their financial problems - pretend to be the real kidnappers, increase the ransom amount, keep the incremental amount for themselves, and then give the original ransom demanded to Kabira. Will they get away with this idea?",Hindi,India,9 wins & 8 nominations,https://m.media-amazon.com/images/M/MV5BNDExMTBlZTYtZWMzYi00NmEwLWEzZGYtOTA1MDhmNTc0ODZkXkEyXkFqcGdeQXVyODE5NzE3OTE@._V1_SX300.jpg,"[{'Source': 'Internet Movie Database', 'Value': '8.2/10'}]",N/A,8.2,"72,345",tt0242519,movie,01 Apr 2019,N/A,N/A,N/A,True
Bhool Bhulaiyaa,2007,Not Rated,12 Oct 2007,159 min,"Comedy, Horror, Mystery",Priyadarshan,"Neeraj Vora, Manisha Korde, Madhu Muttam","Akshay Kumar, Vidya Balan, Shiney Ahuja","When U.S.-based Siddharth visits his Indian home town with his new wife, he insists they stay at the ancestral home, laughing off family members' warnings of ghostly goings-on in the mansion. But events soon make him reconsider his beliefs. As unexplained and terrifying occurrences arise, Siddharth calls on his doctor friend to help solve the mystery. What will be the outcome? Will Siddharth's friend be able to solve this riddle?","Hindi, Bengali",India,1 win & 13 nominations,https://m.media-amazon.com/images/M/MV5BN2Q1ODU2NzQtMDE4Mi00M2ViLTg5NmItYWNlMzBmMDdjNGY0XkEyXkFqcGdeQXVyODE5NzE3OTE@._V1_SX300.jpg,"[{'Source': 'Internet Movie Database', 'Value': '7.4/10'}, {'Source': 'Rotten Tomatoes', 'Value': '33%'}]",N/A,7.4,"31,733",tt0995031,movie,04 Aug 2017,"$1,097,797",N/A,N/A,True
Aashiqui 2,2013,Not Rated,26 Apr 2013,132 min,"Drama, Music, Musical",Mohit Suri,Shagufta Rafique,"Aditya Roy Kapoor, Shraddha Kapoor, Shaad Randhawa","Rahul is a singer, who loses his career due to his drinking habits. He meets Arohi in a bar in Goa, where she works to earn a living. Impressed by her singing, he promises her to take her to Mumbai and make her a star, where they fall in love with each other. Aashiqui 2 is a musical love story of these lovers who goes through love and hate, fame and failure in their lives. However will they stay together accepting their success, or will they breakup due to their ego?",Hindi,India,49 wins & 38 nominations,https://m.media-amazon.com/images/M/MV5BMjEzNzczNTg2M15BMl5BanBnXkFtZTcwMjUxNjk0OQ@@._V1_SX300.jpg,"[{'Source': 'Internet Movie Database', 'Value': '7.1/10'}, {'Source': 'Rotten Tomatoes', 'Value': '17%'}]",N/A,7.1,"32,575",tt2203308,movie,05 Nov 2015,N/A,N/A,N/A,True
Kurbaan,2009,Not Rated,20 Nov 2009,161 min,"Action, Crime, Drama",Renzil D'Silva,"Renzil D'Silva, Niranjan Iyengar, Karan Johar","Lewis Tan, Kareena Kapoor, Saif Ali Khan","Delhi University's Professor Avantika Ahuja meets fellow professor Ehsan Khan in typical Bollywood-film style and they fall in love. Her father, who wanted her to marry a Hindu, reluctantly permits them to get married; after they do, they relocate to the United States. They buy a house, settle in, and are welcomed by their neighbors, Hamid and Anjum. A few days later Avantika's world will be turned upside down when she finds out that their neighbors are terrorists who want to avenge the deaths of innocent Iraqi and Afghani civilians massacred by British and American forces, and that her husband is not who he claims to be.","Hindi, Urdu, English",India,6 wins & 16 nominations,https://m.media-amazon.com/images/M/MV5BMjE3NjQxMjg4NF5BMl5BanBnXkFtZTcwNDQ3NTk5Mw@@._V1_SX300.jpg,"[{'Source': 'Internet Movie Database', 'Value': '5.7/10'}]",N/A,5.7,"5,468",tt1185442,movie,01 Oct 2018,"$754,268",N/A,N/A,True
Don 3: The Final Chapter,2025,N/A,N/A,N/A,"Action, Thriller",Farhan Akhtar,"Farhan Akhtar, Gayatri, Pushkar",Ranveer Singh,Plot under wraps.,Hindi,"United Kingdom, Canada, India",N/A,https://m.media-amazon.com/images/M/MV5BM2FiNjRkZTAtMDJmNy00ZDg5LWEzYTAtYzQ3YTI1N2E2YjQ3XkEyXkFqcGdeQXVyNjY1MTg4Mzc@._V1_SX300.jpg,[],N/A,N/A,N/A,tt5885564,movie,N/A,N/A,N/A,N/A,True
Zid,2014,Not Rated,28 Nov 2014,126 min,"Crime, Romance, Thriller",Vivek Agnihotri,"Vivek Agnihotri, Rohit Malhotra","Mannara Chopra, Karanvir Sharma, Shraddha Das","A journalist, who is still in love with his ex-girlfriend, becomes the obsession of his landlord's daughter.","Hindi, English",India,1 win & 1 nomination,https://m.media-amazon.com/images/M/MV5BMjA2NjQ1MDIzNV5BMl5BanBnXkFtZTgwNjE4OTI4NTE@._V1_SX300.jpg,"[{'Source': 'Internet Movie Database', 'Value': '4.5/10'}]",N/A,4.5,"1,468",tt4228746,movie,05 Nov 2015,N/A,N/A,N/A,True
Ajeeb Daastaans,2021,TV-MA,16 Apr 2021,142 min,"Drama, Romance","Neeraj Ghaywan, Kayoze Irani, Rahul Kamboj","Neeraj Ghaywan, Shashank Khaitan, Uzma Khan","Fatima Sana Shaikh, Jaideep Ahlawat, Armaan Ralhan",Four shorts explore the surprising ways in which unexpected catalysts inflame the uncomfortable emotions simmering under fractured relationships.,Hindi,India,9 wins & 11 nominations,https://m.media-amazon.com/images/M/MV5BM2RjYWI2NGUtNmFkNC00ODM2LWFjYTItOTg2OTE2MzQxNjJmXkEyXkFqcGdeQXVyODE5NzE3OTE@._V1_SX300.jpg,"[{'Source': 'Internet Movie Database', 'Value': '6.7/10'}, {'Source': 'Rotten Tomatoes', 'Value': '100%'}]",N/A,6.7,"6,359",tt14091818,movie,16 Apr 2021,N/A,N/A,N/A,True
Simmba,2018,Not Rated,28 Dec 2018,158 min,"Action, Crime, Drama",Rohit Shetty,"Puri Jagannadh, Vakkantham Vamsi, Yunus Sajawal","Ranveer Singh, Sara Ali Khan, Sonu Sood","Simmba is an orphan from Shivgadh from where our beloved Singham was born and raised. Contrary to the philosophies of Singham, Simmba believes that a Corrupt Officer's life is an ideal life which inspires him to become one. While Simmba enjoys all the perks of being an immoral and unethical Police Officer, a twist in the tale transforms him and forces him to choose the righteous path.","Hindi, Marathi, English",India,5 wins & 15 nominations,https://m.media-amazon.com/images/M/MV5BMWIzNGU3ZWEtNTRjOC00OTYzLWFlZmUtMjE5NmMxMmE0MGIwXkEyXkFqcGdeQXVyNjE1OTQ0NjA@._V1_SX300.jpg,"[{'Source': 'Internet Movie Database', 'Value': '5.5/10'}, {'Source': 'Rotten Tomatoes', 'Value': '27%'}]",N/A,5.5,"21,965",tt7212726,movie,N/A,"$5,102,129",N/A,N/A,True
Dabangg,2010,Not Rated,10 Sep 2010,126 min,"Action, Comedy, Crime",Abhinav Kashyap,"Dilip Shukla, Abhinav Kashyap","Salman Khan, Sonakshi Sinha, Sonu Sood","Set in Uttar Pradesh, Chulbul Pandey is a young boy who lives with his mother Naini, stepfather Prajapati, and younger half-brother Makkhi. Chulbul is constantly angry that his step-father is always partial towards his own biological son. 21 years later, Chulbul is a rowdy, mischievous, and sometimes crooked cop, who refers to himself as ""Robin Hood."" He does everything in his own indomitable way; whether it's dealing with corrupt politician and thug Chedi Singh, fighting a family feud, or romancing stunning Rajo.",Hindi,India,76 wins & 31 nominations,https://m.media-amazon.com/images/M/MV5BMTMyOTQ0Mzg2Ml5BMl5BanBnXkFtZTcwMDcyOTM5NA@@._V1_SX300.jpg,"[{'Source': 'Internet Movie Database', 'Value': '6.2/10'}, {'Source': 'Rotten Tomatoes', 'Value': '60%'}]",N/A,6.2,"34,089",tt1620719,movie,30 Nov 2016,"$1,288,549",N/A,N/A,True
Waltair Veerayya,2023,Not Rated,27 Feb 2023,155 min,"Action, Drama",K.S. Ravindra,"K.S. Ravindra, Kona Venkat, K. Chakravarthy Reddy","Ravi Teja, Shruti Haasan, Prakash Raj",A fisherman who engages in smuggling accepts a request from a disheveled police officer in order to use it to his personal advantage,"Telugu, Hindi, English",India,N/A,https://m.media-amazon.com/images/M/MV5BMzQxYjhmYzgtZTBhYS00MjliLWFkMGUtNjIzN2I1YjhhYzk1XkEyXkFqcGdeQXVyMTA3MDk2NDg2._V1_SX300.jpg,"[{'Source': 'Internet Movie Database', 'Value': '6.2/10'}]",N/A,6.2,"7,579",tt15281402,movie,N/A,"$320,000",N/A,N/A,True
Jogira Sara Ra Ra,2023,N/A,26 May 2023,121 min,"Comedy, Drama, Family",Kushan Nandy,Ghalib Asad Bhopali,"Nawazuddin Siddiqui, Neha Sharma, Vishal Anand","Jogi the match maker and Dimple who seeks help to him to get rid of her marriage, both face the consequences as it is eventually decided that Jogi will marry her to save face.",Hindi,India,N/A,https://m.media-amazon.com/images/M/MV5BYTk4MmQ5NzktOWZhMy00MjdjLWJmMWMtYWRmMjNiZWI5ZTExXkEyXkFqcGdeQXVyODE5NzE3OTE@._V1_SX300.jpg,"[{'Source': 'Internet Movie Database', 'Value': '7.1/10'}]",N/A,7.1,"3,229",tt12862042,movie,N/A,N/A,N/A,N/A,True
Checkmate,2023,18+,12 Jul 2023,112 min,"Action, Comedy","Akriti Bajpai, Harsh Beniwal","Shivam Bajpai, Harsh Beniwal","Harsh Beniwal, Mohit Chhikara, Aditya Paul","An assassin gets hired for a job that throws him in a murky pool of mishaps, eventually leading to a baffling secret.",Hindi,India,N/A,https://m.media-amazon.com/images/M/MV5BMWJhZDc2ZmQtNTY3OS00MmE3LWJhMTEtYjllZjhjN2QwZjhjXkEyXkFqcGdeQXVyMTYxNzIxNTQ0._V1_SX300.jpg,"[{'Source': 'Internet Movie Database', 'Value': '8.0/10'}]",N/A,8.0,"24,135",tt28362963,movie,N/A,N/A,N/A,N/A,True
