Title,Year,Rated,Released,Runtime,Genre,Director,Writer,Actors,Plot,Language,Country,Awards,Poster,Ratings,Metascore,imdbRating,imdbVotes,imdbID,Type,DVD,BoxOffice,Production,Website,Response
Shool,1999,N/A,05 Nov 1999,138 min,"Action, Crime, Drama",Eeshwar Nivas,"Anurag Kashyap, Eeshwar Nivas, Ram Gopal Varma","Manoj Bajpayee, Raveena Tandon, Sayaji Shinde","Police Inspector Samar Pratap Singh is transferred to Motihari, in the Indian state of Bihar, along with his wife Manjari and their daughter. He is honest and diligent and these attributes sets him up against his superior, the District Superintendent of Police, as well as his subordinates and fellow officers. His diligence in maintaining law and order, and his belief in justice for all, regardless of one's background, makes him a powerful enemy in the shape of Bachu Yadav, the local MLA of the ruling political party, who will stop at nothing to get ride of Samar and his family--and nobody will dare to stop him.",Hindi,India,4 wins & 6 nominations,https://m.media-amazon.com/images/M/MV5BMjMyZmNlZWUtNmY0My00ZWMxLWFkN2EtYmNhN2U3ZDFlZGExXkEyXkFqcGdeQXVyODE5NzE3OTE@._V1_SX300.jpg,"[{'Source': 'Internet Movie Database', 'Value': '7.7/10'}]",N/A,7.7,"3,829",tt0220757,movie,27 Mar 2017,N/A,N/A,N/A,True
Dharam Sankat Mein,2015,Not Rated,10 Apr 2015,129 min,Comedy,Fuwad Khan,"Sanjay Sharma, Alpesh Dixit, Vijay Desai","Naseeruddin Shah, Paresh Rawal, Annu Kapoor",Mr Dharam at the age of 55 figures out that he was adopted by a Hindu family after his Muslim father left him.He then tries to Meet his father who is in Critical Condition but the Imam says him to Become a Muslim for that. What Follows Next Are a bunch of comical events,Hindi,India,1 nomination,https://m.media-amazon.com/images/M/MV5BYzdjNTFhOGQtZGEyNi00OTk4LWE2M2QtMzRiNGM0MWNmMWI0XkEyXkFqcGdeQXVyODE5NzE3OTE@._V1_SX300.jpg,"[{'Source': 'Internet Movie Database', 'Value': '6.3/10'}, {'Source': 'Rotten Tomatoes', 'Value': '22%'}]",N/A,6.3,"2,404",tt4354740,movie,28 Mar 2017,N/A,N/A,N/A,True
Class of '83,2020,TV-14,21 Aug 2020,98 min,"Action, Crime, Drama",Atul Sabharwal,"Abhijeet Shirish Deshpande, Atul Sabharwal","Bobby Deol, Anup Soni, Joy Sengupta","A hero policeman shunted to a punishment posting as the Dean of the police academy decides to punish the corrupt bureaucracy and its criminal allies in return by training five lethal assassin policemen. But, like all good plans, it only works for a while until the fire that he has ignited threatens to burn his own house down.",Hindi,India,1 win & 2 nominations,https://m.media-amazon.com/images/M/MV5BNjU2MzAyZWEtYjMxOS00ZGExLWIxZjgtNjY2ZWJmZWQzNWM4XkEyXkFqcGdeQXVyMjUxMTY3ODM@._V1_SX300.jpg,"[{'Source': 'Internet Movie Database', 'Value': '5.8/10'}, {'Source': 'Rotten Tomatoes', 'Value': '17%'}]",N/A,5.8,"5,960",tt10230422,movie,22 Aug 2020,N/A,N/A,N/A,True
Sheran Di Kaum Punjabi,2024,N/A,12 Apr 2024,N/A,"Action, Adventure, Drama",Gippy Grewal,Gippy Grewal,"Sanjay Dutt, Gippy Grewal, Harpreet Kaler",N/A,"Punjabi, Telugu, Tamil, Hindi",India,N/A,https://m.media-amazon.com/images/M/MV5BM2UxZDVhMTItOTM4Zi00MmQ5LThlNDEtYjM0ZWQyNjIxNDU3XkEyXkFqcGdeQXVyMTQ3Mzk2MDg4._V1_SX300.jpg,[],N/A,N/A,N/A,tt16867258,movie,N/A,N/A,N/A,N/A,True
Brothers,2015,Not Rated,14 Aug 2015,156 min,"Action, Drama, Sport",Karan Malhotra,"Gavin O'Connor, Cliff Dorfman, Ekta Pathak Malhotra","Akshay Kumar, Sidharth Malhotra, Jackie Shroff","The story of two estranged brothers comes to play in the rink. David Fernandes quits his job as a Physics teacher to become a full-time fighter. He is willing to do whatever it takes to save his ill daughter. Monty Fernandes creates a storm on the internet with just one video. Finally getting the chance to prove himself to the world, he trains vigorously. Two brothers, two fighters, and one ultimate fight.","Hindi, English","India, United States",1 win,https://m.media-amazon.com/images/M/MV5BNzQ4Njg3Mjg5Nl5BMl5BanBnXkFtZTgwODE5MDg1NjE@._V1_SX300.jpg,"[{'Source': 'Internet Movie Database', 'Value': '6.4/10'}]",N/A,6.4,"13,829",tt3802576,movie,29 Jan 2019,"$613,775",N/A,N/A,True
Deewangee,2002,Not Rated,25 Oct 2002,169 min,"Crime, Drama, Mystery",Anees Bazmee,"Anees Bazmee, Neeraj Pathak","Ajay Devgn, Akshaye Khanna, Urmila Matondkar","Raj is one of city's top lawyer known never to loose a case.He his introduced to Sargam during the launch of her new album by Ashwin Mehta owner of a music company.Next day Ashwin is found murdered and Tarang is held for the murder,Sargam and Tarang are childhood friends and she approaches Raj to fight for his case. During this period Raj notices that Tarang suffers from mental illness of split personality and when he suffers the attack he is not Tarang but Ranjeet and doesn't remember things he does when he turns Ranjeet.Tarang had killed Ashwin as the previous night he saw him forcing on Sargam but doesn't remember killing him as he was Ranjeet that time.Raj wins the case in court by proving Tarang innocent as he is suffering from mental illness.Tarang is due to release and gives Raj a shock to that he had planned everything regarding split personality as he was caught red handed on the site of murder.",Hindi,India,6 wins & 2 nominations,https://m.media-amazon.com/images/M/MV5BODBkOTRkZDgtNzI3My00YWZkLWE5NjAtNmQxMjAwYTY3YjYxXkEyXkFqcGdeQXVyODE5NzE3OTE@._V1_SX300.jpg,"[{'Source': 'Internet Movie Database', 'Value': '6.5/10'}]",N/A,6.5,"3,046",tt0337971,movie,25 Feb 2017,N/A,N/A,N/A,True
Madaari,2016,Not Rated,22 Jul 2016,133 min,"Drama, Thriller",Nishikant Kamat,"Shailja Kejriwal, Ritesh Shah","Irrfan Khan, Jimmy Shergill, Vishesh Bansal",'Madaari' is the story of a common man who sets out to avenge the death of his son caused by rampant corruption in the government. Losing the only family he had brings him to kidnap the home minister's son and bring those responsible to justice.,Hindi,India,2 nominations,https://m.media-amazon.com/images/M/MV5BZDFjODM0NDAtNGJkZC00NmRiLWI3NmYtZDFkYmRhYmE4Zjk3XkEyXkFqcGdeQXVyNTIwODMzNjc@._V1_SX300.jpg,"[{'Source': 'Internet Movie Database', 'Value': '7.6/10'}, {'Source': 'Rotten Tomatoes', 'Value': '78%'}]",N/A,7.6,"14,897",tt5713232,movie,04 Apr 2017,N/A,N/A,N/A,True
Bawarchi,1972,Not Rated,07 Jul 1972,130 min,"Comedy, Musical, Drama",Hrishikesh Mukherjee,"Tapan Sinha, Hrishikesh Mukherjee, Gulzar","Rajesh Khanna, Jaya Bachchan, Usha Kiran","Squabbling Sharma family has a dubious reputation of not having any cook last there for more than a few months. Word spreads out about this family to such an extent that no person wants to be employed as a cook in this household, ironically named Shanti Nivas (""Abode of Peace""). Then one day a young man named Raghu offers to work as a cook and he is hired. Raghu quickly gets a grip on his job and on each of the family members, and soon their internal squabbles and arguments come to an end. And then the Sharmas find that Raghu might have been too good to be true.",Hindi,India,2 wins,https://m.media-amazon.com/images/M/MV5BMTg5NDIyNzAwOV5BMl5BanBnXkFtZTgwMjk3ODM3NDE@._V1_SX300.jpg,"[{'Source': 'Internet Movie Database', 'Value': '8.1/10'}]",N/A,8.1,"4,318",tt0068257,movie,13 Dec 2016,N/A,N/A,N/A,True
Breakaway,2011,PG-13,23 Sep 2011,101 min,"Comedy, Drama, Sport",Robert Lieberman,"Vinay Virmani, Noel S. Baker, Jeff Schechter","Vinay Virmani, Camilla Belle, Russell Peters","A hockey enthusiast since 12 years of age, Toronto-based Rajvinder Singh, even went to the extent of trimming his hair, discarding his Pagri/turban, did not complete his education, incurred the wrath of his father, Darvesh, who wanted him to be involved in the family business as well as confirm and respect Sikh religion principles and values. Hoping to play professional hockey, Rajvinder, along with other fellow Sikh players, instead finds himself treated as the object of ridicule, referred to as a 'joker', by mainstream Caucasian players. Even his friends tease him and ask him to take up 'Guli Danda' and Kabaddi', while his father makes him work for Uncle Sammy as a truck driver. He is attracted to stunning law student Melissa Winters while her brother, Dan, offers to coach Rajvinder and his team. Unable to get themselves included in any team, they form their own, and call it 'Speedy Singhs'. They then set about to make a name for themselves with a coach who is unable to pronounce their names, and assumes that they belong to the same family as all their last names are 'Singh'. The team, headed by Rajvinder, has an uphill task, challenging the reigning champions 'Hammerheads', while Rajvinder must counsel his school-going brother, Gurveer, who is being harassed for looking 'different', deal with family pressures - especially after Darvesh announces that his son has forsaken hockey once and for all.","English, Hindi, Punjabi","Canada, India, United States",N/A,https://m.media-amazon.com/images/M/MV5BMTUxOTIxNTI3NF5BMl5BanBnXkFtZTcwOTI4NjgwNg@@._V1_SX300.jpg,"[{'Source': 'Internet Movie Database', 'Value': '5.7/10'}, {'Source': 'Rotten Tomatoes', 'Value': '17%'}]",N/A,5.7,"2,483",tt1736552,movie,24 Dec 2012,N/A,N/A,N/A,True
Mughal-E-Azam,1960,Not Rated,05 Aug 1960,197 min,"Drama, Romance, War",K. Asif,"K. Asif, Aman, Kamal Amrohi","Prithviraj Kapoor, Madhubala, Dilip Kumar","Set in the 16th century AD, the movie brings to life the tale of the doomed love affair between the Mughal Crown Prince Saleem and the beautiful, ill-fated court dancer, whose fervor and intensity perpetrates a war between the prince and his father the great Mughal Emperor Akbar, and threatens to bring an empire to its knees.","Hindi, Urdu",India,3 wins & 3 nominations,https://m.media-amazon.com/images/M/MV5BMmM2YWQ3MzctOTk1NS00NThhLWExY2MtYjQzZGRmZTFiYWY3XkEyXkFqcGdeQXVyMjUxMTY3ODM@._V1_SX300.jpg,"[{'Source': 'Internet Movie Database', 'Value': '8.1/10'}, {'Source': 'Rotten Tomatoes', 'Value': '92%'}]",N/A,8.1,"8,741",tt0054098,movie,22 May 2017,"$161,434",N/A,N/A,True
A Gentleman,2017,Not Rated,25 Aug 2017,145 min,"Action, Comedy","George Aguilar, Krishna D.K., Raj Nidimoru","Raj Nidimoru, Krishna D.K., Sita Menon","Jacqueline Fernandez, Sidharth Malhotra, Suniel Shetty","Gaurav is on a mission to settle down. He is in the process of trying to charm Kavya into creating life with him and getting married. However, Kavya dreads the thought of taking the plunge and settling down. Her only wish is that her ""sundar susheel"" gentleman lives life to the full, with a little more risk and excitement. However, things take an interesting twist when an assignment takes Gaurav to Mumbai.",Hindi,India,1 win & 1 nomination,https://m.media-amazon.com/images/M/MV5BMDFkMjlhM2ItZGVjYy00YzAyLWFmMjEtNDM5OGNmODFmMzhkXkEyXkFqcGdeQXVyNjY1MTg4Mzc@._V1_SX300.jpg,"[{'Source': 'Internet Movie Database', 'Value': '6.2/10'}, {'Source': 'Rotten Tomatoes', 'Value': '50%'}]",N/A,6.2,"7,316",tt5613834,movie,13 Dec 2017,"$410,055",N/A,N/A,True
Rock On!!,2008,Not Rated,29 Aug 2008,145 min,"Drama, Music",Abhishek Kapoor,"Farhan Akhtar, Pubali Chaudhuri, Abhishek Kapoor","Arjun Rampal, Farhan Akhtar, Luke Kenny",Four friends reunite to relive their moments of glory as a rock band.,Hindi,India,22 wins & 41 nominations,https://m.media-amazon.com/images/M/MV5BMTM2NjIwODc4N15BMl5BanBnXkFtZTcwMDgwMzM4MQ@@._V1_SX300.jpg,"[{'Source': 'Internet Movie Database', 'Value': '7.7/10'}]",N/A,7.7,"22,874",tt1230165,movie,13 Jun 2016,N/A,N/A,N/A,True
Evil Eye,2020,Not Rated,13 Oct 2020,90 min,"Horror, Mystery, Thriller","Elan Dassani, Rajeev Dassani",Madhuri Shekar,"Sarita Choudhury, Sunita Mani, Bernard White","A curse from the past reawakens in the present to torment a family in Evil Eye, a stylish suspense thriller with a supernatural edge. From her home in Delhi, India, proud parent Usha Khatri (Sarita Choudhury) is overjoyed when her daughter Pallavi (Sunita Mani) calls from New Orleans with news that she has met someone special. But Usha's happiness turns to fear when she notices strange similarities between Pallavi's wealthy boyfriend Sandeep (Omar Maskati) and a frightening figure from her own past. Although her suspicions are dismissed by friends and family, the more Usha learns about this new man in her daughter's life, the more certain she becomes that an evil force from 30 years earlier has returned with a vengeance. When Pallavi announces her engagement to Sandeep, Usha is forced to confront a terrifying question: How do you protect the ones you love when the thing you fear most won't stay dead?","English, Hindi","India, United States",1 win & 1 nomination,https://m.media-amazon.com/images/M/MV5BZjc1YWE4YTUtM2UzOS00MDUwLTkxNmYtZGFkZGViZDY0MWRlXkEyXkFqcGdeQXVyODE0OTU5Nzg@._V1_SX300.jpg,"[{'Source': 'Internet Movie Database', 'Value': '4.8/10'}, {'Source': 'Rotten Tomatoes', 'Value': '43%'}, {'Source': 'Metacritic', 'Value': '54/100'}]",54,4.8,"4,157",tt12882620,movie,13 Oct 2020,N/A,N/A,N/A,True
Margarita with a Straw,2014,Not Rated,14 Jun 2016,100 min,Drama,"Shonali Bose, Nilesh Maniyar","Shonali Bose, Nilesh Maniyar, Atika Chohan","Kalki Koechlin, Revathi, Sayani Gupta","***SPOILERS ALERT!!*** Laila is a teenager with cerebral palsy, studying at Delhi University. She is an aspiring writer and also composes music for an indie band at the university. Laila develops feelings for the lead singer, but is heartbroken when she is rejected. Moving on from the experience, Laila is overjoyed to receive a scholarship for a semester's study at New York University. Despite her father's reservations, she moves to Greenwich Village, Manhattan with her orthodox Maharashtrian mother Shubhangini. Laila meets an attractive young man named Jared, who is assigned to help her in the creative writing class. She also meets a young activist, Khanum (Gupta), a blind girl of Pakistani-Bangladeshi descent, with whom she falls in love. Laila is enamored by Khanum's fiercely independent personality and her positive perspective towards her own disability. The two spend most of their time together, filling in as each other's caregivers. Laila becomes confused about her sexual orientation, as she is attracted to men-Jared in particular-while being in a serious relationship with Khanum. She has sex with Jared, only to regret it immediately. Laila does not tell Khanum about this encounter. Oblivious to her daughter's relationship with Khanum, Laila's mother invites Khanum to Delhi to spend the winter vacation with Laila's family. Laila ultimately finds the courage to tell her mother about her sexuality and her relationship with Khanum, both of which her mother strongly disapproves of. Laila also confesses to Khanum that she had sex with Jared and asks for her forgiveness. Feeling betrayed by Laila, Khanum breaks up with her and leaves for New York. Laila's mother is diagnosed with advanced colon cancer which has relapsed after previous treatments. Laila and her mother move past their differences while Laila tends to her mother at the hospital. The two eventually reconcile shortly before Shubhangini's death. Laila plays a recorded speech at her mother's funeral telling how much she loved her and how she was the only one who ever understood her. Laila is later seen enjoying a day in the country by herself.","Hindi, English",India,17 wins & 20 nominations,https://m.media-amazon.com/images/M/MV5BMTA5MzA1NDU4OTZeQTJeQWpwZ15BbWU4MDU0Mzk1ODgx._V1_SX300.jpg,"[{'Source': 'Internet Movie Database', 'Value': '7.2/10'}, {'Source': 'Rotten Tomatoes', 'Value': '85%'}, {'Source': 'Metacritic', 'Value': '63/100'}]",63,7.2,"4,070",tt2929690,movie,10 Aug 2016,N/A,N/A,N/A,True
Rakshak India's Braves,2023,N/A,11 Aug 2023,75 min,"Action, Biography",Akshay Choubey,"Bijesh Jayarajan, Aparna Nadig","Aayat, Jatin Ahuja, Ravi Aneja","The bravery of Lieutenant Triveni Singh, a young soldier who gave his own life to protect over 300 people who were caught in the cross firing at the Jammu railway station in a terrorist attack in 2004.",Hindi,India,N/A,https://m.media-amazon.com/images/M/MV5BMzQwYjE4MGQtODlkZi00YzMxLWE3MjMtZGI3YzQwN2FmMzQ4XkEyXkFqcGdeQXVyMTUyMTUzNjQ0._V1_SX300.jpg,[],N/A,N/A,211,tt28635101,movie,N/A,N/A,N/A,N/A,True
The Diplomat,2024,N/A,11 Jan 2024,N/A,"Drama, Thriller",Shivam Nair,Ritesh Shah,"John Abraham, Sadia Khateeb, Kumud Mishra","Based on a story of an Indian diplomat who tries to repatriate an Indian girl from Pakistan, where she was presumably forced and deceived into marrying against her will.",Hindi,India,N/A,https://m.media-amazon.com/images/M/MV5BNDAwZTc3YWYtNTRlZC00ZWQ5LThkMWEtZjI4MzIyYTkyYjQxXkEyXkFqcGdeQXVyOTI3MzI4MzA@._V1_SX300.jpg,[],N/A,N/A,N/A,tt26229612,movie,N/A,N/A,N/A,N/A,True
Koyla,1997,Not Rated,07 Apr 1997,166 min,"Action, Drama, Musical",Rakesh Roshan,"Sachin Bhowmick, Ravi Kapoor, Anwar Khan","Shah Rukh Khan, Madhuri Dixit, Amrish Puri","Mute Shankar slogs day and night to satisfy the lust of wealthy businessman Raja Saab who has underworld contact. Raja Saab would like to marry the young and street-wise, Gauri, however Gauri would like to see a picture of her would be husband but is instead shown Shankar's picture, she immediately falls in love with him and agrees to marry but at the wedding altar, Gauri gets a shock when she sees Raja Saab, refuses to continue with the rituals of the marriage and is locked forever in a room. Circumstances forced Shankar and Gauri to elope but both is caught by Raja and his men, who beats Shankar and throw him to his death and Gauri is taken back to Raja Saab mansion and must undergo preparations to get married to him.",Hindi,India,3 nominations,https://m.media-amazon.com/images/M/MV5BMTkyODI2NzQzMl5BMl5BanBnXkFtZTcwNzYyNDE0MQ@@._V1_SX300.jpg,"[{'Source': 'Internet Movie Database', 'Value': '6.2/10'}]",N/A,6.2,"9,826",tt0136352,movie,30 Nov 2016,"$37,795",N/A,N/A,True
Trimurti,1995,Not Rated,22 Dec 1995,187 min,"Action, Drama",Mukul Anand,"Athar Nawaaz, Karan Razdan","Jackie Shroff, Anil Kapoor, Shah Rukh Khan","Entrapped by notorious gangster, Khokha Singh; an honest police inspector Satyadevi Singh gets a life sentence in jail. She hopes to get her three sons, Shakti, Anand and Romi to avenge this carnage but the three have all parted ways and due to this separation they develop hatred for each other. They all takes up different jobs and identity in life.",Hindi,India,2 nominations,https://m.media-amazon.com/images/M/MV5BMjAxODA1OTY1Nl5BMl5BanBnXkFtZTgwMzQ4ODk1MDE@._V1_SX300.jpg,"[{'Source': 'Internet Movie Database', 'Value': '4.8/10'}]",N/A,4.8,"2,953",tt0114726,movie,27 Jul 1999,N/A,N/A,N/A,True
Thappad,2020,Not Rated,28 Feb 2020,142 min,Drama,Anubhav Sinha,"Mrunmayee Lagoo, Anubhav Sinha","Taapsee Pannu, Pavail Gulati, Kumud Mishra",Amrita and Vikram Sabharwal are happily married Vikram works in a reputed company while Amrita is a homemaker and her life surrounds only around him.Vikram gets promotion and they are soon to shift to London and throw a celebration party at the party Vikram finds that he wont be heading the London office and will have to work under his junior.Vikram gets in tiff with his colleague for the same while Amrita is trying to stop him and gets slapped by him this incident hurts her very badly and life does not remain the same for while Amrita decides to leaves the house and shift at her parents place further also taking the matter to the court.,Hindi,India,19 wins & 33 nominations,https://m.media-amazon.com/images/M/MV5BYTdiZWUzMGQtNmM5ZS00NjcyLTllMzgtMTEyMWEyNzliOGJjXkEyXkFqcGdeQXVyODE5NzE3OTE@._V1_SX300.jpg,"[{'Source': 'Internet Movie Database', 'Value': '7.0/10'}, {'Source': 'Rotten Tomatoes', 'Value': '93%'}]",N/A,7.0,"26,651",tt10964430,movie,01 May 2020,N/A,N/A,N/A,True
Joker,2012,Not Rated,31 Aug 2012,104 min,"Comedy, Family, Sci-Fi",Shirish Kunder,Shirish Kunder,"Akshay Kumar, Sonakshi Sinha, Shreyas Talpade","In 1947 when the maps of India and Pakistan were being drawn, an oversight ensured that the village of Paglapur didn't find a place in either country. The village had the distinction of housing the largest mental asylum in the region and in the mle that ensued during partition, the asylum inmates broke loose, drove away the villagers and established their own republic in Paglapur. And that's how it stayed for the next 60 years! While the world outside changed, Paglapur remained isolated, with no electricity, television or sanity. Now, decades after the world forgot this village, a NASA scientist of Indian origin, Agastya and his beautiful wife find themselves on the road to Paglapur. Agastya is working on a top secret project for creating a device to communicate with aliens. So why is he in a village whose colorful inhabitants include a man who speaks in gibberish, another who thinks he is a lamp post and everyone else who think Mahatma Gandhi is still around, fighting for independence? And more importantly, what are they going to do that will soon turn the universe's spotlight on this forgotten village?",Hindi,India,5 wins & 1 nomination,https://m.media-amazon.com/images/M/MV5BMjE0NjIxODMxN15BMl5BanBnXkFtZTcwMjM5MDcxOA@@._V1_SX300.jpg,"[{'Source': 'Internet Movie Database', 'Value': '2.4/10'}, {'Source': 'Rotten Tomatoes', 'Value': '0%'}]",N/A,2.4,"5,787",tt1918886,movie,03 Aug 2018,"$169,181",N/A,N/A,True
Nazar Andaaz,2022,N/A,07 Oct 2022,103 min,"Comedy, Drama",Vikrant Deshmukh,"Vikrant Deshmukh, Sameer Hallim, Sonali Shani Pednekar","Abhishek Banerjee, Shyam Bhimsaria, Divya Dutta","Sudhir, blind by birth, lives alone with his housemaid Bhavani. While Bhavani is out, he takes in Ali to help around the house. Both Bhavani and Ali grow envious of each other. Nazar Andaaz is a comedic yet heartfelt story of thes...",Hindi,India,N/A,https://m.media-amazon.com/images/M/MV5BZTBhNGFkMzItMjRjOC00MTdiLTk4NTYtYmQ5MTA0ZThiYmY5XkEyXkFqcGdeQXVyOTM4MDQ2OTU@._V1_SX300.jpg,"[{'Source': 'Internet Movie Database', 'Value': '7.2/10'}]",N/A,7.2,"1,662",tt22311492,movie,N/A,N/A,N/A,N/A,True
Gulabo Sitabo,2020,N/A,12 Jun 2020,124 min,"Comedy, Drama","Shoojit Sircar, Kuran Dhillon",Juhi Chaturvedi,"Amitabh Bachchan, Ayushmann Khurrana, Vijay Raaz","Welcome to the world of Gulabo Sitabo where two slimy scheming foxes in a game of one-upmanship, each one attracting other members to their clan and each one with an agenda of his own. Meet 'Mirza' (Amitabh Bachchan) - a 78yrs old landlord, who would move heaven and earth for his most prized possession - an old dilapidated mansion in the heart of Lucknow. But this garden of roses comes with its own cluster of 'pricky thorns' - tenants. Amongst them most prominently, 'Baankey' (Ayushmann Khuranna)' a shrewd, sly and squatted tenant, who matches Mirza bit for a bit in their ceaseless bantering. Gulabo Sitabo is a quirky slice of life where Mirza and Baankey are like Tom and Jerry - unique and unmatched, friend and foe, naughty and smart, little and large, all combine to produce chaos.",Hindi,India,7 wins & 21 nominations,https://m.media-amazon.com/images/M/MV5BN2E2NGQzNzQtNTVhMS00NjdhLTk3MzgtNDFkOTg2YTg1MmFkXkEyXkFqcGdeQXVyODE5NzE3OTE@._V1_SX300.jpg,"[{'Source': 'Internet Movie Database', 'Value': '6.3/10'}, {'Source': 'Rotten Tomatoes', 'Value': '73%'}]",N/A,6.3,"13,387",tt10333912,movie,12 Jun 2020,N/A,N/A,N/A,True
Phobia,2016,Not Rated,27 May 2016,112 min,"Drama, Mystery, Thriller",Pavan Kirpalani,"Pavan Kirpalani, Arun Sukumar, Pooja Ladha Surti","Radhika Apte, Amrita Bagchi, Nivedita Bhattacharya","Mehak is a talented young artist who, after surviving a traumatic attack, develops severe agoraphobia. She is terrified of the outside world. Her friend Shaan believes a new setting might help her heal, and moves her into a recently vacated apartment. Between the strange behavior of the neighbors and the mysterious disappearance of the apartment's former tenant, Mehak begins to fear that her new home might be the most dangerous place of all. Is it all in her mind or is there a real danger haunting her?","Hindi, English",India,1 win & 2 nominations,https://m.media-amazon.com/images/M/MV5BMmVlMzIxYjAtZTQwNC00ZTc0LThhOTYtNTZlNWZmZDU0ZWI4XkEyXkFqcGdeQXVyODE5NzE3OTE@._V1_SX300.jpg,"[{'Source': 'Internet Movie Database', 'Value': '6.8/10'}, {'Source': 'Rotten Tomatoes', 'Value': '100%'}]",N/A,6.8,"3,205",tt5743656,movie,23 Feb 2018,N/A,N/A,N/A,True
B.A. Pass 2,2017,N/A,15 Sep 2017,125 min,Drama,"Shadab Khan, Shadab Khan","Shadab Khan, Shadab Khan","Kritika Sachdeva, Satiiysh Saarathy Sasho, Sanghmitra Hitaishi","B. A. Pass 2 is the story of a young girl, who, in order to achieve her goals and to avoid marriage, makes a few wrong decisions and adopts ill habits that eventually ruin her life.",Hindi,India,N/A,https://m.media-amazon.com/images/M/MV5BNDAxMWU4ZGMtMGVhYi00ZTFhLTg4OTItYmM2NDMwNzJiYTA5XkEyXkFqcGdeQXVyNTIxMDYxNTg@._V1_SX300.jpg,"[{'Source': 'Internet Movie Database', 'Value': '2.2/10'}]",N/A,2.2,542,tt8581230,movie,01 Jun 2018,N/A,N/A,N/A,True
Commando,2013,Not Rated,12 Apr 2013,124 min,"Action, Adventure, Thriller",Dilip Ghosh,Ritesh Shah,"Vidyut Jammwal, Hsieh Chang Hai, Nelson Liao Sheng Hua","Captain Karan Dogra's helicopter crashes on China border during a training. Karan is suspected to spy in China and it becomes difficult for him as well as senior Indian officer's to convince the Chinese government that he wasn't a spy.The Indian Government disowns Karan and he is tortured in China and has to face a trial during a court hearing, he manages to escape via the Himachal-Punjab border and comes across a young girl Simrit whose escaping from Amrit Kanwal (AK 47) who wants to marry Smmrit for political benefits and has control over the whole region.Karan decides to help Simrit a she feels that these are the enemies within the country.",Hindi,India,6 nominations,https://m.media-amazon.com/images/M/MV5BYjE3YzY3NzQtN2JkZC00OTU3LWI4NmUtYWU5ZDM0MDljNTI0XkEyXkFqcGdeQXVyNjQ2MjQ5NzM@._V1_SX300.jpg,"[{'Source': 'Internet Movie Database', 'Value': '6.3/10'}]",N/A,6.3,"5,873",tt2658126,movie,N/A,N/A,N/A,N/A,True
